<?xml version="1.0" encoding="UTF-8"?>
<data xmlns="http://www.woltlab.com" xmlns:xsi="http://www.w3.org/2001/XMLSchema-instance" xsi:schemaLocation="http://www.woltlab.com http://www.woltlab.com/XSD/6.0/userOption.xsd">
	<import>
		<categories>
			<category name="profile">
				<showorder>1</showorder>
			</category>
			<!-- profile -->
			<category name="profile.aboutMe">
				<parent>profile</parent>
			</category>
			<category name="profile.personal">
				<parent>profile</parent>
			</category>
			<category name="profile.contact">
				<parent>profile</parent>
			</category>
			<!-- /profile -->
			<category name="settings">
				<showorder>2</showorder>
			</category>
			<!-- settings -->
			<category name="settings.general">
				<parent>settings</parent>
				<showorder>1</showorder>
			</category>
			<category name="settings.general.appearance">
				<parent>settings.general</parent>
				<showorder>1</showorder>
			</category>
			<category name="settings.general.interface">
				<parent>settings.general</parent>
				<showorder>2</showorder>
			</category>
			<category name="settings.general.date">
				<parent>settings.general</parent>
				<showorder>3</showorder>
			</category>
			<category name="settings.privacy">
				<parent>settings</parent>
				<showorder>2</showorder>
			</category>
			<category name="settings.privacy.content">
				<parent>settings.privacy</parent>
			</category>
			<category name="settings.privacy.messaging">
				<parent>settings.privacy</parent>
			</category>
		</categories>
		<options>
			<!-- profile -->
			<option name="aboutMe">
				<categoryname>profile.aboutMe</categoryname>
				<optiontype>aboutMe</optiontype>
				<visible>15</visible>
				<editable>3</editable>
				<messageObjectType>com.woltlab.wcf.user.aboutMe</messageObjectType>
			</option>
			<option name="birthday">
				<categoryname>profile.personal</categoryname>
				<optiontype>birthday</optiontype>
				<searchable>1</searchable>
				<visible>15</visible>
				<editable>3</editable>
			</option>
			<option name="birthdayShowYear">
				<categoryname>profile.personal</categoryname>
				<optiontype>boolean</optiontype>
				<defaultvalue>1</defaultvalue>
				<editable>3</editable>
			</option>
			<option name="gender">
				<categoryname>profile.personal</categoryname>
				<optiontype>select</optiontype>
				<defaultvalue>0</defaultvalue>
				<selectoptions>0:wcf.global.noDeclaration
1:wcf.user.gender.male
2:wcf.user.gender.female
3:wcf.user.gender.other</selectoptions>
				<searchable>1</searchable>
				<visible>15</visible>
				<editable>3</editable>
			</option>
			<option name="location">
				<categoryname>profile.personal</categoryname>
				<optiontype>text</optiontype>
				<searchable>1</searchable>
				<visible>15</visible>
				<editable>3</editable>
			</option>
			<option name="occupation">
				<categoryname>profile.personal</categoryname>
				<optiontype>text</optiontype>
				<searchable>1</searchable>
				<visible>15</visible>
				<editable>3</editable>
			</option>
			<option name="hobbies">
				<categoryname>profile.personal</categoryname>
				<optiontype>text</optiontype>
				<searchable>1</searchable>
				<visible>15</visible>
				<editable>3</editable>
			</option>
			<option name="adminComment">
				<categoryname>profile.personal</categoryname>
				<optiontype>textarea</optiontype>
				<visible>2</visible>
				<editable>2</editable>
			</option>
			<option name="homepage">
				<categoryname>profile.contact</categoryname>
				<optiontype>URL</optiontype>
				<validationpattern>^$|^https?://</validationpattern>
				<searchable>1</searchable>
				<visible>15</visible>
				<editable>3</editable>
			</option>
			<option name="facebook">
				<categoryname>profile.contact</categoryname>
				<optiontype>text</optiontype>
				<validationpattern>^$|^[A-Za-z\d.]{5,}$</validationpattern>
				<searchable>1</searchable>
				<visible>15</visible>
				<editable>3</editable>
				<contentpattern>^https?://www.facebook.com/([A-Za-z\d.]{5,})$</contentpattern>
			</option>
			<option name="twitter">
				<categoryname>profile.contact</categoryname>
				<optiontype>text</optiontype>
				<validationpattern>^$|^[A-Za-z0-9_]+$</validationpattern>
				<searchable>1</searchable>
				<visible>15</visible>
				<editable>3</editable>
				<contentpattern>^https?://twitter.com/([A-Za-z0-9_]+)$</contentpattern>
			</option>
			<!-- /profile -->
			<!-- settings -->
			<option name="recentActivitiesFilterByFollowing">
				<categoryname>hidden</categoryname>
				<optiontype>boolean</optiontype>
				<defaultvalue>1</defaultvalue>
			</option>
			<option name="colorScheme">
				<categoryname>hidden</categoryname>
				<optiontype>select</optiontype>
				<selectoptions>system:wcf.style.setColorScheme.system
light:wcf.style.setColorScheme.light
dark:wcf.style.setColorScheme.dark</selectoptions>
				<defaultvalue>system</defaultvalue>
			</option>
			<option name="timezone">
				<categoryname>settings.general.date</categoryname>
				<optiontype>timezone</optiontype>
				<editable>3</editable>
			</option>
			<option name="showSignature">
				<categoryname>settings.general.appearance</categoryname>
				<optiontype>boolean</optiontype>
				<defaultvalue>1</defaultvalue>
				<options>module_user_signature</options>
				<editable>3</editable>
			</option>
			<!-- settings.privacy.content -->
			<option name="canViewOnlineStatus">
				<categoryname>settings.privacy.content</categoryname>
				<optiontype>select</optiontype>
				<defaultvalue>0</defaultvalue>
				<selectoptions>0:wcf.user.access.everyone
1:wcf.user.access.registered
2:wcf.user.access.following
3:wcf.user.access.nobody</selectoptions>
				<editable>3</editable>
				<permissions>user.profile.canHideOnlineStatus</permissions>
			</option>
			<option name="canViewProfile">
				<categoryname>settings.privacy.content</categoryname>
				<optiontype>select</optiontype>
				<defaultvalue>0</defaultvalue>
				<selectoptions>0:wcf.user.access.everyone
1:wcf.user.access.registered
2:wcf.user.access.following
3:wcf.user.access.nobody</selectoptions>
				<editable>3</editable>
			</option>
			<option name="canViewTrophies">
				<categoryname>settings.privacy.content</categoryname>
				<optiontype>select</optiontype>
				<defaultvalue>0</defaultvalue>
				<options>module_trophy</options>
				<permissions>user.profile.trophy.canSeeTrophies</permissions>
				<selectoptions>0:wcf.user.access.everyone
1:wcf.user.access.registered
2:wcf.user.access.following
3:wcf.user.access.nobody</selectoptions>
				<editable>3</editable>
			</option>
			<option name="enableEmbeddedMedia">
				<categoryname>settings.privacy.content</categoryname>
				<optiontype>boolean</optiontype>
				<defaultvalue>0</defaultvalue>
				<editable>3</editable>
				<options>message_enable_user_consent</options>
			</option>
			<!-- settings.privacy.messaging -->
			<option name="canViewEmailAddress">
				<categoryname>settings.privacy.messaging</categoryname>
				<optiontype>select</optiontype>
				<defaultvalue>3</defaultvalue>
				<selectoptions>0:wcf.user.access.everyone
1:wcf.user.access.registered
2:wcf.user.access.following
3:wcf.user.access.nobody</selectoptions>
				<editable>3</editable>
			</option>
			<option name="adminCanMail">
				<categoryname>settings.privacy.messaging</categoryname>
				<optiontype>boolean</optiontype>
				<defaultvalue>1</defaultvalue>
				<editable>3</editable>
			</option>
			<!-- /settings -->
			<option name="canWriteProfileComments">
				<categoryname>settings.privacy.messaging</categoryname>
				<optiontype>select</optiontype>
				<defaultvalue>1</defaultvalue>
				<selectoptions>0:wcf.user.access.everyone
1:wcf.user.access.registered
2:wcf.user.access.following
3:wcf.user.access.nobody</selectoptions>
				<options>module_user_profile_wall</options>
				<editable>3</editable>
			</option>
		</options>
	</import>
	<delete>
		<option name="editorPastePreserveFormatting"/>
		<option name="icq"/>
		<option name="skype"/>
	</delete>
</data>
